Keyword,Volume,Keyword Difficulty,CPC (USD),Competitive Density,Number of Results,SERP Features,Trend
best sit stand desk,1300,82.97,3.18,1.00,76800000,"Site Links, Featured Snippet","1.00,1.00,0.68,0.77,1.00,1.00,0.77,1.00,0.77,1.00,1.00,0.77"
aliexpress code,1000,82.82,0.32,0.52,175000000,"Site Links, Reviews, Featured Snippet","0.20,0.77,0.68,0.68,0.68,0.77,0.77,0.77,0.77,1.00,1.00,1.00"
amazon wedding dresses plus size,1000,99.81,0.34,1.00,53,"Images, Reviews","0.77,0.55,0.68,1.00,0.77,0.68,0.68,0.68,0.68,1.00,0.77,0.68"
cold shoulder cocktail dress,1000,87.05,1.03,1.00,99,"Images, Site Links, Reviews","0.68,0.55,0.55,0.55,0.55,0.68,1.00,1.00,0.77,1.00,0.77,1.00"
delta airlines cheap flights,1000,83.02,0.60,0.46,18800000,"Instant Answer, Site Links, Reviews","0.63,0.55,0.45,0.55,0.45,1.00,0.55,0.55,0.63,0.63,0.63,0.55"
el cozumeleno,1000,82.83,0.84,0.27,185000,"Knowledge Panel, Images, Site Links, Reviews","0.46,0.53,0.53,1.00,0.68,0.84,0.53,0.46,0.46,0.38,0.31,0.25"
low carb breakfast on the go,1000,82.10,1.82,1.00,53700000,"Site Links, Reviews","0.81,0.63,0.45,1.00,0.63,0.63,0.63,0.55,0.55,0.63,0.63,0.63"
best keto,880,91.87,1.70,1.00,108000000,"Site Links, Reviews, Featured Snippet","0.59,0.48,0.59,1.00,0.88,0.88,0.88,0.88,0.88,0.72,0.88,0.88"
flight hotel deals,880,86.08,1.13,0.75,160000000,"Site Links, Reviews","0.72,0.72,0.72,1.00,1.00,1.00,0.88,0.88,0.72,0.88,0.72,0.72"
how to lose weight when pregnant,880,90.23,2.49,0.04,84700000,,"0.88,0.88,0.88,1.00,0.88,1.00,1.00,1.00,1.00,0.88,0.88,0.72"
plus size gothic wedding dresses,880,80.08,0.74,1.00,90,"Images, Reviews","0.55,0.30,0.24,0.55,0.45,0.45,0.37,0.37,0.37,0.63,0.81,1.00"
search optimization,880,81.02,8.30,0.33,928000000,"Knowledge Panel, Top Stories, Site Links, Reviews","0.55,0.45,0.45,0.55,0.68,1.00,1.00,0.77,0.77,0.77,0.77,0.77"
28 day keto meal plan,720,75.53,0.93,1.00,39700000,"Images, Site Links, Reviews","0.21,0.48,0.59,0.72,0.72,1.00,0.88,0.88,0.88,0.88,0.88,0.72"
4.7 dodge engine for sale,720,69.70,1.20,1.00,7940000,"Images, Site Links, Reviews","0.82,1.00,0.67,0.67,0.82,0.82,1.00,0.82,1.00,1.00,0.67,1.00"
costco disney vacation,720,84.59,1.30,0.04,2270000,"Images, Site Links, Reviews","0.72,0.59,0.72,1.00,0.88,1.00,0.72,0.72,0.72,0.72,0.59,0.72"
gym tops,720,87.83,0.95,1.00,234000000,"Images, Site Links","0.55,0.55,0.55,1.00,0.82,1.00,0.82,0.67,0.82,0.82,1.00,0.82"
keto almond milk,720,73.96,2.64,1.00,14900000,"Reviews, Video, Featured Snippet","0.48,0.39,0.48,1.00,0.72,0.88,0.72,0.59,0.59,0.72,0.72,0.59"
triple a travel agent,720,87.53,1.82,0.27,36800000,"Images, Site Links, Reviews","0.45,0.45,0.45,1.00,0.68,0.77,0.55,0.55,0.55,0.55,0.55,0.45"
used wedding gowns,720,75.75,0.34,1.00,64600000,"Local Pack, Images, Site Links, Reviews","0.88,0.59,0.72,1.00,0.88,0.88,0.59,0.72,0.72,0.72,0.72,0.72"
best marketing agencies,590,66.83,7.35,0.67,260000000,"Local Pack, Reviews","0.67,0.55,0.55,0.55,0.67,0.82,1.00,0.82,0.55,0.55,0.55,0.55"
cocktail formal,590,84.36,1.34,1.00,328000000,"Site Links, Reviews, Featured Snippet","0.44,0.67,0.67,0.55,0.44,0.55,0.67,0.67,0.67,0.67,0.82,1.00"
dodge challenger engine,590,79.34,1.75,0.85,0,"Knowledge Panel, Carousel, Site Links, Reviews","0.67,0.55,0.44,0.55,0.67,0.67,0.67,0.82,0.82,0.82,1.00,1.00"
free lesbian dating websites,590,72.94,1.45,0.88,33000000,"Site Links, Reviews, Video, Featured Snippet","0.25,0.13,0.11,0.11,0.20,0.30,0.45,1.00,0.77,0.55,0.37,0.55"
plus size high low formal dresses,590,87.24,0.47,1.00,60500000,"Local Pack, Images, Site Links, Reviews","0.82,0.67,0.55,1.00,0.82,1.00,0.67,0.67,0.55,0.55,0.67,0.82"
slimfast plan,590,85.84,2.54,0.94,1690000,"Images, Site Links, Reviews, Featured Snippet","0.44,0.44,0.55,0.82,0.67,1.00,0.82,0.55,0.55,0.67,0.67,0.55"
white study desk,590,91.26,0.95,1.00,293000000,"Images, Site Links, Reviews","0.59,0.48,0.39,0.72,0.39,0.48,0.32,0.39,0.48,0.72,1.00,0.88"
christmas travel deals,480,85.40,1.20,0.52,418000000,"Images, Site Links, Reviews","0.53,1.00,0.68,0.01,0.03,0.02,0.04,0.04,0.06,0.14,0.21,0.31"
construction injury lawyer,480,57.45,146.02,0.62,41800000,"Local Pack, Site Links, Reviews","0.11,0.06,0.30,0.20,0.30,0.45,0.55,1.00,0.07,0.11,0.11,0.09"
landscaping on a budget,480,82.82,1.68,0.24,132000000,"Local Pack, Images, Site Links, Reviews","0.24,0.16,0.13,0.30,0.36,0.82,1.00,1.00,0.82,0.82,0.67,0.55"
planning a small wedding,480,76.72,1.50,0.96,230000000,"Images, Site Links","0.66,0.66,0.66,1.00,0.81,0.81,0.81,0.81,0.81,0.81,0.81,0.66"
pruning shears lowes,480,96.57,0.49,1.00,66,"Images, Site Links, Reviews","0.36,0.44,0.44,0.44,0.36,0.55,0.82,1.00,0.82,0.82,0.67,0.55"
traumatic brain injury attorney,480,57.98,66.72,0.09,12500000,"Site Links, Reviews","0.67,0.16,0.30,0.44,1.00,0.55,0.55,0.36,0.30,0.67,1.00,1.00"
vellum invitation,480,68.62,1.58,1.00,4640000,"Images, Reviews","0.29,0.29,0.29,0.82,0.67,0.82,0.67,0.82,0.82,1.00,1.00,0.82"
1800 calorie diet plan,390,81.53,1.05,0.22,2660000,"Images, Reviews, Video","1.00,0.44,0.36,0.67,0.36,0.54,0.67,0.54,0.44,0.82,0.54,0.44"
a line cocktail dress mid length,390,86.94,1.20,1.00,264000000,"Images, Site Links, Reviews","0.67,0.44,0.44,0.54,0.67,1.00,0.67,0.44,0.29,0.44,0.19,0.24"
casa velas boutique hotel,390,81.09,2.02,0.35,2520000,"Knowledge Panel, Site Links, Reviews","0.29,0.29,0.36,0.66,0.81,0.54,1.00,0.66,0.66,1.00,0.66,0.81"
cheap healthy meal plan for one,390,77.26,1.81,0.36,207000000,Reviews,"0.54,0.44,0.54,1.00,0.66,0.66,0.54,0.81,0.81,0.81,0.66,0.66"
desert landscape backyard,390,71.74,2.42,0.06,15400000,"Images, Site Links, Reviews","0.24,0.19,0.19,0.24,0.19,0.36,0.44,0.44,0.67,1.00,0.82,0.67"
expedia deal of the day,390,90.71,2.68,0.23,26600000,"Images, Site Links, Reviews, Video","0.81,0.81,0.67,0.81,0.81,1.00,0.81,0.81,0.81,1.00,0.81,0.54"
garage remodel cost,390,71.32,3.65,1.00,28400000,"Images, Site Links, Featured Snippet","0.81,0.67,0.67,1.00,0.67,0.81,0.81,0.81,0.81,1.00,1.00,0.81"
bohemian bridal gowns,320,77.33,0.74,1.00,12500000,"Images, Site Links, Reviews","0.82,0.13,0.54,0.82,1.00,1.00,0.82,0.82,0.82,0.67,0.82,1.00"
family court legal aid,320,73.21,2.75,0.47,162000000,"Local Pack, Site Links","0.82,0.67,0.67,0.82,0.67,0.82,1.00,1.00,0.82,1.00,0.82,0.67"
famous female lawyers,320,78.87,0.00,0.01,0,"Carousel, Images","0.54,0.44,0.36,1.00,0.66,0.66,0.54,0.44,0.36,0.44,0.54,0.54"
ross formal dresses plus size,320,85.05,0.39,1.00,76,"Images, Site Links, Reviews","0.81,0.44,0.24,1.00,1.00,0.29,0.54,0.44,0.66,0.54,0.54,0.81"
simple backyard landscaping,320,82.32,2.01,1.00,38900000,"Images, Site Links","0.07,0.07,0.10,0.13,0.13,0.29,0.44,0.54,0.82,1.00,0.67,0.67"
7 day low carb meal plan,260,84.64,0.97,0.76,25500000,"Images, Site Links, Reviews","0.66,0.53,0.34,0.81,0.81,0.81,0.81,1.00,1.00,1.00,1.00,0.81"
bohemian attire for men,260,80.07,0.80,1.00,9120000,"Images, Site Links, Reviews","0.29,0.35,0.35,0.35,0.35,0.29,0.29,0.44,0.54,1.00,0.81,1.00"
craftsman lawn mower battery replacement,260,84.95,0.66,1.00,85,"Images, Site Links, Reviews","0.24,0.24,0.15,0.19,0.19,0.54,1.00,0.81,0.54,0.36,0.36,0.29"
discount solar panels,260,66.71,2.77,1.00,309000000,Site Links,"0.81,0.66,0.81,0.66,1.00,1.00,0.81,1.00,1.00,1.00,1.00,0.81"
how to lose 5 pounds in a day quickly,260,81.75,1.47,0.04,133000000,"Site Links, Reviews, Featured Snippet","0.66,0.81,0.53,0.81,0.81,0.66,0.81,0.53,0.66,0.81,0.81,1.00"
lace and beads,260,84.37,0.72,1.00,84900000,"Images, Reviews","0.81,0.66,0.66,0.81,0.81,0.81,1.00,0.66,0.53,0.66,1.00,0.81"
modern wedding gown,260,82.45,0.87,1.00,84200000,"Site Links, Featured Snippet","0.81,0.53,0.53,1.00,0.81,0.44,0.66,0.66,0.81,0.81,0.81,0.81"
money advisor,260,74.26,3.33,0.41,337000000,"Site Links, Reviews, Featured Snippet","1.00,0.81,1.00,1.00,0.81,1.00,1.00,1.00,1.00,1.00,1.00,1.00"
plus size going out clothes,260,82.58,1.21,1.00,307000000,"Images, Site Links, Reviews","0.29,0.36,0.24,0.44,0.54,0.44,0.36,0.29,0.36,0.44,0.66,1.00"
solar incentives by state,260,69.43,2.61,0.46,26900000,"Site Links, Video, Featured Snippet","0.54,0.54,0.54,0.67,0.67,0.82,0.82,0.67,0.67,0.82,1.00,0.82"
tall office desk,260,86.17,2.41,1.00,441000000,"Images, Site Links, Reviews","1.00,0.66,0.53,1.00,0.66,0.81,0.81,0.66,0.81,0.81,0.81,0.81"
uber eats offer,260,87.93,3.69,0.23,334000000,"Site Links, Reviews, Video, Featured Snippet","0.66,0.66,0.81,1.00,0.66,0.81,0.66,0.53,0.66,0.81,1.00,0.81"
black travel agencies,210,67.69,2.56,0.28,224000000,"Reviews, Video, Featured Snippet","0.66,0.44,0.53,0.66,0.81,0.81,0.66,0.66,0.66,1.00,0.81,0.66"
corner study desk,210,89.15,0.89,1.00,66400000,"Images, Site Links, Reviews, Video","0.36,0.36,0.44,0.44,0.36,0.54,0.44,0.28,0.54,0.67,1.00,0.82"
ggn landscape,210,73.75,0.00,0.01,309000,"Knowledge Panel, Images, Site Links, Reviews","1.00,0.65,0.81,1.00,0.81,1.00,0.81,1.00,0.81,0.81,1.00,0.54"
keto challenge free,210,77.59,0.62,0.58,20100000,"Images, Site Links, Reviews, Video","0.22,0.28,0.66,0.81,0.44,0.44,0.81,0.81,0.53,0.66,1.00,0.66"
keto diet meal plan for beginners,210,84.79,0.94,1.00,149000000,"Site Links, Reviews, Featured Snippet","0.54,0.54,1.00,0.67,0.67,0.28,0.44,0.54,0.67,0.28,0.54,0.44"
one month weight loss plan,210,87.95,2.37,0.33,205000000,"Images, Video, Featured Snippet","0.81,0.81,0.54,1.00,1.00,0.65,0.81,0.54,0.65,0.81,0.65,0.65"
plain desk,210,80.26,0.76,1.00,184000000,"Images, Site Links, Reviews, Video","0.54,1.00,1.00,0.81,0.65,0.65,0.81,0.81,0.81,1.00,1.00,0.65"
qwertee discount code,210,77.65,1.14,0.04,94400,"Images, Reviews","0.23,0.44,0.13,0.36,0.82,1.00,0.67,0.67,0.36,0.54,0.82,0.44"
travel agent viator,210,77.13,19.39,0.16,1860000,"Site Links, Reviews","0.34,0.34,0.28,0.53,0.66,0.81,0.81,1.00,1.00,1.00,0.81,0.81"
us virgin islands resorts all inclusive adults only,210,86.39,0.73,0.36,790000,"Images, Site Links, Featured Snippet","1.00,1.00,0.81,0.67,0.35,0.54,0.23,0.15,0.29,0.19,0.19,0.15"
$69 flights,170,89.56,0.51,0.63,1700000,"Site Links, Reviews, Video","0.23,0.23,0.15,1.00,0.54,0.44,0.29,0.35,0.35,0.23,0.19,0.19"
600 calorie a day diet,170,81.42,0.95,0.06,9760000,Images,"0.42,0.54,0.35,1.00,0.65,0.65,0.81,1.00,0.65,0.65,0.54,0.42"
affiliate marketing programs for beginners,170,61.30,3.88,0.63,134000000,"Site Links, Featured Snippet","0.81,0.65,0.54,0.42,0.42,0.65,0.65,0.65,0.81,1.00,1.00,0.65"
cocktail dresses evening wear plus size,170,85.69,0.72,1.00,32100000,"Images, Site Links","0.42,0.65,1.00,1.00,0.42,1.00,0.35,1.00,0.65,0.65,0.81,0.65"
flower bed tiller,170,81.65,0.73,1.00,2610000,"Images, Site Links, Reviews","0.06,0.06,0.04,0.08,0.19,0.67,0.81,1.00,0.54,0.23,0.29,0.19"
paperless post wedding invitations,170,80.04,1.53,0.55,430000,"Site Links, Reviews, Featured Snippet","0.43,0.52,0.52,1.00,0.81,0.81,1.00,0.81,0.81,1.00,1.00,0.81"
pof free browse,170,79.09,0.81,0.14,81,"Site Links, Reviews, Video","0.13,0.36,1.00,0.67,0.54,0.54,0.28,0.44,0.28,0.44,0.28,0.28"
social media marketing agency pricing,170,55.94,7.30,0.88,595000000,"Site Links, Featured Snippet","0.43,0.33,0.52,1.00,0.81,0.81,0.67,0.81,0.81,0.81,0.81,0.67"
square wedding invitation,170,74.83,1.94,1.00,41200000,"Reviews, Featured Snippet","0.35,0.42,0.42,1.00,1.00,0.81,0.65,0.54,0.54,1.00,0.65,0.65"
transparent invitations,170,75.88,1.61,0.97,85800000,"Images, Site Links, Reviews","0.27,0.27,0.42,1.00,0.81,0.81,0.54,0.65,0.81,0.81,0.65,0.81"
tree nurseries in my area,170,61.33,1.89,0.71,176000000,"Local Pack, Images, Site Links","0.36,0.44,0.13,0.08,0.10,0.54,1.00,1.00,0.54,0.28,0.67,0.54"
wells fargo finet,170,71.04,0.00,0.01,75,"Images, Site Links, Video","0.81,0.81,0.54,1.00,0.81,0.65,0.81,0.65,0.54,0.65,0.65,0.81"
best website to book vacation packages,140,87.80,1.61,0.59,351000000,"Site Links, Featured Snippet","0.34,0.22,0.34,0.66,0.44,0.53,1.00,0.44,0.34,0.22,0.28,0.34"
body for life diet plan,140,80.25,2.28,0.97,295000000,"Images, Reviews, Featured Snippet","1.00,1.00,0.65,0.81,0.54,0.65,0.54,0.54,0.35,0.42,0.19,0.35"
cheap vacations in march 2019,140,85.07,0.00,0.00,360000000,"Site Links, Featured Snippet","0.24,0.24,0.44,1.00,0.54,0.08,0.00,0.02,0.02,0.02,0.02,0.00"
date black singles,140,75.52,1.21,0.80,348000000,"Site Links, Reviews","0.27,0.27,0.42,0.42,0.54,0.42,0.35,0.42,0.42,0.65,1.00,0.81"
gogo vacations travel agent,140,66.11,2.81,0.06,2610000,"Images, Site Links, Reviews","0.43,0.43,0.33,0.67,0.52,0.67,0.67,0.81,0.43,0.67,0.67,1.00"
high quality garden tools,140,63.62,0.82,1.00,283000000,"Images, Site Links, Reviews","0.35,0.35,0.65,0.19,0.35,0.65,0.81,1.00,0.65,0.42,0.35,0.35"
how to lose weight but keep muscle,140,79.35,2.41,0.04,128000000,"Images, Reviews, Featured Snippet","0.14,0.19,0.67,1.00,0.43,0.52,1.00,0.81,0.43,0.67,0.81,0.52"
kumquat tree for sale near me,140,72.01,0.81,1.00,2200000,"Images, Reviews","0.27,0.35,0.42,0.54,1.00,0.81,0.65,0.81,0.65,0.54,0.54,0.27"
sears kitchen remodel,140,80.64,6.40,1.00,1890000,"Images, Reviews, Video","1.00,0.65,0.82,0.65,0.82,1.00,0.82,1.00,1.00,0.82,1.00,1.00"
smith and hawken garden tools,140,74.26,0.35,0.98,292000,"Images, Reviews, Video","0.27,0.27,0.65,0.54,0.35,0.65,0.81,0.81,1.00,0.65,0.65,0.42"
solar powered battery charger for phone,140,87.00,1.47,1.00,18200000,"Site Links, Reviews, Featured Snippet","0.27,0.42,0.35,0.42,0.42,0.42,0.54,0.42,0.54,0.65,1.00,0.54"
suze orman financial advice,140,82.41,4.31,0.54,265000,"Knowledge Panel, Site Links, Reviews","0.82,0.53,0.65,1.00,0.82,1.00,0.82,0.82,0.65,0.53,0.65,0.65"
800 calorie diet menu,110,77.95,0.66,0.11,3310000,"Images, Video","0.82,0.41,0.53,1.00,0.53,0.53,0.53,0.53,0.65,0.82,0.82,0.65"
free legal advice new mexico,110,68.27,2.77,0.80,98300000,"Local Pack, Site Links","0.50,0.50,0.64,1.00,0.64,0.64,0.50,1.00,0.79,0.79,1.00,1.00"
how to get rid of belly fat after pregnancy,110,0.00,2.17,1.00,0,,"0.19,0.67,0.67,0.33,0.24,0.52,1.00,0.52,0.43,0.33,0.67,0.43"
ppc digital marketing,110,0.00,9.95,0.48,0,,"0.41,0.53,0.65,0.53,0.65,0.65,0.65,0.53,0.82,0.65,1.00,0.82"
product mix strategies,110,79.76,0.00,0.01,121000000,"Images, Site Links, Featured Snippet","1.00,1.00,0.53,0.41,0.65,1.00,0.82,0.82,0.41,0.24,0.29,0.41"
rebath tubs,110,56.71,3.46,1.00,506000,"Images, Site Links, Reviews","0.22,0.28,0.34,1.00,0.22,0.28,0.44,0.34,0.53,0.34,0.34,0.16"
solar panel prices 2019,110,0.00,2.94,1.00,0,,"0.05,0.24,0.33,0.33,0.67,0.52,0.67,0.81,0.81,1.00,0.67,0.14"
wedding invitation from parents,110,72.26,1.53,1.00,37400000,"Images, Site Links","0.24,0.43,0.43,0.67,0.52,0.67,0.52,0.52,0.52,1.00,0.67,0.43"
walk in shower replacement,20,75.29,3.36,0.99,33400000,"Images, Site Links, Reviews","0.03,0.02,0.02,0.19,0.03,0.03,0.02,0.19,0.02,1.00,0.36,0.36"
